Key,Description,Standard,EN
SAY.Chapter1.1395.Protagonist,,我有听闻您为了举办这场追悼会牺牲了自己的职业生涯，大家都感到很惋惜。,I have heard that you sacrificed your career to hold this memorial service. Everyone feels very sorry.
SAY.Chapter1.1396.Robert,,没有什么好惋惜的，失去Rebecca后我已经无心事业了，不如退出来把资源与机会让给别人。,"There is nothing to regret. After losing Rebecca, I am no longer interested in my career. It is better to quit and pass resources and opportunities to others."
SAY.Chapter1.1397.Robert,,Rebecca死后，我即使活着，也不过是形如枯槁，了却残生罢了。,"After Rebecca's death, even though I was alive, I would only look like a withered, but be left alive."
SAY.Chapter1.1398.Protagonist,,请不要这样说，Rebecca也一定是希望您能好好地继续活着。,"Please don't say that, Rebecca must also hope that you can continue to live well."
SAY.Chapter1.1399.Robert,,谢谢你的安慰，我会活着，至少在弄清楚她是怎么死之前我还不可以放弃。,"Thank you for your comfort, I will live, at least I can't give up until I figure out how she died."
SAY.Chapter1.2188.Protagonist,,I found out that still someone believes that Antony is not guilty.,
SAY.Chapter1.2189.Robert,,"Maybe, there are a lots of paradox in the case which are not be solved yet. The worst situation is that the murder might still in this campus.",
SAY.Chapter1.2191.Protagonist,,But who do you think could still insist Antony is innocent?,
SAY.Chapter1.2190.Robert,,"Hard to say, as I know, he didn't have any close friend at that time. The one I could consider is his lawyer.",
SAY.Chapter1.2193.Protagonist,,Wait? You mean Antony's lawyer is here? Today?,
SAY.Chapter1.2192.Robert,,"Yes, she is university's legal advisor for the construction. Guess the president is really content about her achievement - diminishing a severe scandal that almost ruined school's reputation.",
SAY.Chapter1.2196.,,New Info:\nAntony's Lawyer is now university's legal consultant.,
SAY.Chapter1.1317.Protagonist,,我从一些同学的口中得知了这场活动的捐款会用来帮助反对PUA。想必这就是害死您女儿的真凶吧。,I learned from some students that the donations from this event will be used to help oppose PUA. Presumably this is the real culprit who killed your daughter.
SAY.Chapter1.1318.Robert,,看来你一定是与Sophie做了充分沟通，不过这并不是一个好的开始。,"It seems that you must have fully communicated with Sophie, but this is not a good start."
SAY.Chapter1.1320.Protagonist,,您的意思是？Sophie所告诉我的事情并不可信？,What do you mean? What Sophie told me is not credible?
SAY.Chapter1.1321.Robert,,正是如此，我知道有很多人都赞同Antony是杀人凶手这个说法。即使我知道这么想会让我好受一些，可这不符合我一贯严谨的作风。,"I know that many people agree with the statement that Antony is a murderer. Even though thinking like this will make me feel better, it does not conform to my usual rigorous style."
SAY.Chapter1.1323.Robert,,我参加了每一次庭审，每一句证词每一个证物我都记得，检察院仍然缺少关键信息证明他就是凶手。,"I participated in every trial, remembering every testimony, and every exhibit. The procurator still lacked key information to prove that he was the murderer."
SAY.Chapter1.1324.Robert,,作为一名信奉科学的教师，我无法仅凭一些捕风捉影的谣言就给一个孩子扣上杀人犯的罪名。,"As a teacher who believes in science, I cannot convict a child as a murderer based on some rumors."
SAY.Chapter1.1325.Protagonist,,可是这也无法证明他不是凶手是不是？如果他真的清白，为什么这么多年有的学生仍然不愿接受判决结果？,"But this does not prove that he is not the murderer, is it? If he is really innocent, why are some students still reluctant to accept the verdict for so many years?"
SAY.Chapter1.1319.Robert,,我能理解他们这些后辈对Rebecca的崇拜，这层滤镜让他们陷入不理智的狂热。因为他们的偶像死了，所以他们一定要抓出一只替罪羊。,"I can understand the admiration of Rebecca by them. This layer of filter makes them fall into an irrational frenzy. Because their idol is dead, they must catch a scapegoat."
SAY.Chapter1.1326.Robert,,否则他们也不知道如何发泄自己的怒火。即使是受过高等教育的大学生，一旦感性起来也与乌合之众没有什么区别。,Otherwise they don't know how to vent their anger. Even college students who have received higher education are no different from the mob once they become emotional.
SAY.Chapter1.1327.Protagonist,,这话是不是有些冷血？他们可是在为您的女儿鸣不平。,Are these words too cruel? They do their best to grieve your daughter.
SAY.Chapter1.1328.Robert,,我仍然很感谢他们的帮助，只不过他们给不了我想要的真相。,"I still appreciate their help, but they can't give the truth I want."
SAY.Chapter1.1329.Robert,,或许我们任何一个置身其中的人都没有办法找到Rebecca真正的死因。与她的羁绊使我们没有客观看待这个案件。,Perhaps none of us in it can find the real cause of Rebecca's death. The “fetters” with her prevented us from looking at this case objectively.
SAY.Chapter1.1330.Robert,,我们想的最终都是，我们希望她是如何死去。,In the end what we think about is only how we want her to die.
SAY.Chapter1.1331.Protagonist,,所以这就是您向我提问的原因吗？因为我是一个局外人。,So is that why you asked me the question? Because I am an outsider.
SAY.Chapter1.1332.Robert,,有时候局外人更是一种优势。如果我是局外人，或许Rebecca活着的时候我就能发现一些端倪。,"Sometimes outsiders are an advantage. If I were an outsider, maybe I could find some clues while Rebecca was still alive."
SAY.Chapter1.1354.Robert,,你很擅长观察与思考，如果可以的话，请代替我这个不称职的父亲找出Rebecca死亡的真相。,"You are good at observing and thinking. If you can, please find out the truth about Rebecca's death on behalf of me, a incompetent father."
SAY.Chapter1.2049.Robert,,"This is the note I took during the trial, you may need more background information from it.",
SAY.Chapter1.2327.,,New Item:\nYou got the trial transcript.\n,
SAY.Chapter1.1333.Robert,,后天这里将会成为施工现场，同时追悼会也会结束。那一天的早晨，请再来这里告诉我你的结论。,"Ten days later this will become a construction site, and the memorial service will also end. That morning, please come here again and tell me your conclusion."
SAY.Chapter1.1335.Protagonist,,我从媒体方面知道了这是一场不幸的意外。,I learned from the media that this was an unfortunate accident.
SAY.Chapter1.1336.Robert,,这确实是最官方的报道，无论是法院还是学校都支持这个结论。,"This is indeed the most official report, and both the court and the school support this conclusion."
SAY.Chapter1.1338.Robert,,但是，这也是在审判持续半年后陪审团无奈得出的结论。,"However, this is also the conclusion reached by the jury after the trial lasted for half a year."
SAY.Chapter1.1337.Protagonist,,您是说？意外只是因为无法破案的无奈之举？这样做是不是也太草率了？,You mean? The accident was just a helpless act because the case cannot be solved yet? Isn't this too hasty?
SAY.Chapter1.1339.Robert,,持续半年参加陪审可不容易，如果不是毅力非常，普通人很难最后还有力气来对案件进行合理分析。,It is not easy to participate in the jury for half a year. It is difficult for ordinary people to have the strength to analyze the case reasonably under such tired condition.
SAY.Chapter1.1340.Robert,,我想最后他们也放弃了等待检察院所谓的“关键证据”，决定草草结案。,"I think in the end they also gave up waiting for the so-called ""key evidence"" by the procurator and decided to close the case hastily."
SAY.Chapter1.1341.Protagonist,,为什么您觉得就不可能是意外呢？我听闻令嫒去世时可是凌晨，没有看清路不小心失足不是不可能。,"Why do you think it can't be an accident? I heard that it was midnight when Rebecca died, and it was not impossible to accidentally stumble without seeing the road clearly."
SAY.Chapter1.1342.Robert,,我对Rebecca最自豪的一点就是严谨，认真的态度，是个做科研的好苗子。,What I am most proud of about Rebecca is her rigorous and serious. She is a good kid for scientific research.
SAY.Chapter1.1343.Robert,,如果不是有特别重要的事，我想不出有什么需要她半夜三更去湖边玩耍的理由。,"If it weren't for something particularly important, I couldn't think of any reason why she needed to go to the lake to play at the midnight."
SAY.Chapter1.1345.Robert,,尤其第二天她需要作为毕业生代表发表全校演讲，她应该在家认真准备演讲稿才对。,Especially the next day she needs to deliver a school-wide speech as a representative of the graduates. She should prepare the speech carefully at home.
SAY.Chapter1.1344.Protagonist,,所以您认为Rebecca的死是有人有意为之？如果真是这样凶手岂不是还逍遥法外？,"So you think that Rebecca's death was intentional? If this is the case, then the murderer is still free?"
SAY.Chapter1.1346.Robert,,实话实说，我时至今日仍无法下定论，或许作为她的父亲我反而看不清究竟发生了什么。,"To be honest, I still can’t make a conclusion today, maybe as her father I can’t see exactly what happened."
SAY.Chapter1.1347.Robert,,每当我认真思考时，脑子里只会浮现她的笑容。,"Whenever I think seriously, only her smile appears in my mind."
SAY.Chapter1.1348.Protagonist,,那有什么我可以帮到您的吗？我对Rebecca的死也深感惋惜，这样一个优秀的女孩不应该死的不明不白。,Is there anything I can do for you? I also deeply regret the death of Rebecca. Such excellent girl should not die without any reason.
SAY.Chapter1.1349.Robert,,我看的出来你不是一位仅仅为花边新闻而感到满足的人，如果可以的话，请接下我的委托。,"I can see that you are not a person who is only satisfied with gossips. If you can, please accept my commission."
SAY.Chapter1.1355.Robert,,或许你能比我们任何人都更快发现这桩持续了两年的噩梦究竟发生了什么。,"Perhaps you can discover what happened to this nightmare that lasted for two years, faster than any of us."
SAY.Chapter1.2329.Robert,,"This is the note I took during the trial, you may need more background information from it.",
SAY.Chapter1.2332.,,New Item:\nYou got the trial transcript.\n,
SAY.Chapter1.1356.Robert,,十天后这里将会成为施工现场，同时追悼会也会结束。那一天的早晨，请再来这里告诉我你的结论。,"Ten days later this will become a construction site, and the memorial service will also end. That morning, please come here again and tell me your conclusion."
SAY.Chapter1.1434.Protagonist,,调查还没有结束，我还不可以离开这里。,"The Investigation is not over yet, I should still stay here."
SAY.Chapter1.1489.Protagonist,,"I didn't expect the journey to take this long. And with this constant rain, I'm damp all over.\n","I didn't expect that it would take more than an hour to get here. And the rain has been endless, making my whole body smell  musty."
SAY.Chapter1.1490.Protagonist,,"This case better be worth it. My editor thinks it is, but she's not the one travelling out into the wilderness…\n",I hope that the case the editor gave me this time is worth traveling all the way to this wilderness.
SAY.Chapter1.1491.Protagonist,,I should review the information she gave me. Thank god my bag kept it all dry.\n,"That's right, I brought some photocopies of relevant information in my bag."
SAY.Chapter1.1511.Protagonist,,The Daily Post tends to focus on the biggest stories from the city. I remember reading it a lot when I was younger.\n,"Here it is, the Daily Post, a newspaper focusing on the “most important” news in the city. I read a lot when I was a child."
SAY.Chapter1.1512.Protagonist,,"Read carefully and discover what this case is about. (Drag the newspaper with the left mouse key, and investigate with the magnifying glass).\n",Read carefully and figure out what is the case about. ( Drag the newspaper with left mouse key and investigate with the magnifier.)
SAY.Chapter1.2778.Protagonist,,"If there is any useful information, click on {color=red}Investigation{/color}to test it.",
SAY.Chapter1.2374.Protagonist,,"This is it, the trial transcript. Finally I got a documents that may reveal what happened on that day.",
SAY.Chapter1.2375.Protagonist,,Maybe I could find the next person I want to visit from it.,
SAY.Chapter1.1507.Protagonist,,This isn't relevant to the case.\n,"No, I don't need this now."
SAY.Chapter1.1593.Protagonist,,这些花束又是怎么回事？为什么摆得到处都是。\n难道现在毕业季流行摆白色菊花？虽然看起来有些毛骨悚然，但仔细看却清雅别致，现在的年轻人真是时髦。,"What's with these bouquets? Why are they everywhere? Is it popular to use white chrysanthemums for graduation now? Although it looks a little creepy at first, it does create an elegant and chic feel. Maybe it's a new trend among today's youth."
SAY.Chapter1.1594.Protagonist,,话说回来不愧是新闻上反复强调的一流高校，占地面积很大，简直像一座小型城市。,"Having said that, the campus is worthy of a first-class university that's always making the news. This place looks like a small city."
SAY.Chapter1.1595.Protagonist,,还是找张地图看看我现在的位置在哪里。,I need to find a map to figure out where I am now.
SAY.Chapter1.1597.,,"Mission: ""Find the campus map.""",
SAY.Chapter1.1663.Protagonist,,"This is the entrance of the lake, where Rebecca died. Right now it's a {color=red}muddy construction scene{/color}. The barrier is locked and no one is allowed to approach.",
SAY.Chapter1.1664.Protagonist,,"After couple of months, this lake would be filled and become the place of the new library.",
SAY.Chapter1.1665.Protagonist,,The distance from the campus to the lake is quite far. I wonder why Rebecca went to the lake at that night?,
SAY.Chapter1.2358.Protagonist,,"I still cannot ensure who is exactly the murderer. But base on what I know, I might can make an assumption.",
SAY.Chapter1.1678.Protagonist,,There are a lots comments that everybody wrote to Rebecca. Maybe I could find some useful information in them.,
SAY.Chapter1.1779.Protagonist,,"If I want to go out, I need to open the door.",
SAY.Chapter1.1838.Security,,"Excuse me, this building is for students only. I'm going to need to see some ID.\n",
SAY.Chapter1.1842.Protagonist,,"{i}(Damn, I wasn't expecting any security… I hope this doesn't take long.){/i}\n",
SAY.Chapter1.1843.Security,,Please show me some ID or I'll have to ask you to leave.\n,
SAY.Chapter1.1844.Protagonist,,Well...\n,
MENU.Chapter1.1845,,Frankly it's none of your business who I am.\n,
MENU.Chapter1.1846,,"I'm here to see an old friend, one of the faculty.\n",
SAY.Chapter1.1849.Protagonist,,You need to let me in.,
SAY.Chapter1.1851.Anonymous Student,,Unless you show me who you are looking for.,
SAY.Chapter1.2163.Protagonist,,{i}(I definitely cannot say that I am chasing a girl that I even don't know the name. Is there anyone that I know might relate to this building?){/i},
SAY.Chapter1.1852.Protagonist,,Fine! I am looking for......,
SAY.Chapter1.1860.Security,,"If you refuse to provide any ID, then you will be removed from the premises.\n",
SAY.Chapter1.1863.Protagonist,,"I'm just looking for one of the professors, I'm not a threat!\n",
SAY.Chapter1.1864.Security,,I'll be the judge of that Miss. Who are you looking for? \n,
SAY.Chapter1.1862.Security,,I'm going to need to know more than that Miss to let you in.\n,
SAY.Chapter1.1865.Security,,"Specifically, which faculty member are you here to see?\n",
SAY.Chapter1.1880.Protagonist,,Why should I have to prove anything to you?\n,
SAY.Chapter1.1881.Security,,"Well then, if really don't want to show me anything -\n",
SAY.Chapter1.1882.Robert,,I will happily escort you out myself!\n,
SAY.Chapter1.1918.Protagonist,,I'm here for Professor Rochester. I'm one of his ex-students - I wanted to come and pay respects on the anniversary of Rebecca's passing.\n,
SAY.Chapter1.1919.Security,,A lot of journalists have been hanging around saying the exact same thing.\n,
SAY.Chapter1.1920.Security,,How can I trust that you're not one of them?\n,
SAY.Chapter1.1921.Protagonist,,{i}(They must have had a lot of issues with the press to be this suspicious. How do I get past him?){/i}\n,
SAY.Chapter1.1972.Protagonist,,These are flowers for Professor Rochester. They were Rebecca's favorite flowers actually. I thought he'd appreciate the gift.\n,
SAY.Chapter1.1973.Security,,Ahh… I'm sure he'll be touched by the thought. Apologies for wasting your time Miss.\n,
SAY.Chapter1.2143.Protagonist,,"Come on man, chill out. You don't have to be this stubborn.\n",
SAY.Chapter1.2185.Security,,It's my job to ensure the campus remains a safe place -\n,
SAY.Chapter1.2151.Protagonist,,"I totally get that! And I guarantee you, I won't make any trouble. Here, have this.\n",
SAY.Chapter1.2144.Security,,Are you trying to buy me off with… one cigarette?\n,
SAY.Chapter1.2184.Protagonist,,Would you prefer I email your boss to complain about a member of their security team smoking inside?\n,
SAY.Chapter1.2152.Security,,"Damn it. Okay fine, but just this once, OK?\n",
SAY.Chapter1.1979.Protagonist,,I'm bringing this as a... gift to him.\n,
SAY.Chapter1.1980.Security,,"Well then, if you honestly think I'll believe that 'that' is somehow a gift -\n",
SAY.Chapter1.1981.Robert,,I'll have to escort you out of this building myself!\n,
SAY.Chapter1.2040.Protagonist,,"Oh God, it's already afternoon. I don't want to continue the investigation with starving.",
SAY.Chapter1.2042.Protagonist,,There is a cafeterial  on campus. Maybe I should grab some food first.,
SAY.Chapter1.2167.,,"Mission: ""Buy some food.""",
SAY.Chapter1.2053.Shop Assistant,,"Hi, what can I help you today?",
SAY.Chapter1.2052.Protagonist,,{i}(Is there any thing that I want to buy?){/i},
SAY.Chapter1.2058.Protagonist,,"Please give me a cup of coffee, no cream no sugar.",
SAY.Chapter1.2060.Shop Assistant,,"Sure, here is your extrem bitter coffee.",
SAY.Chapter1.2064.Shop Assistant,,You need to pay for your coffee.,
SAY.Chapter1.2063.Protagonist,,Ehhh...... Sorry I don't have enough money.,
SAY.Chapter1.2079.Protagonist,,Please give me tea.,
SAY.Chapter1.2080.Shop Assistant,,"Ok, it's 5, you can pay now.",
SAY.Chapter1.2082.Shop Assistant,,You need to pay for your coffee.,
SAY.Chapter1.2083.Protagonist,,Ehhh...... Sorry I don't have enough money.,
SAY.Chapter1.2069.Protagonist,,May I have a sandwich?,
SAY.Chapter1.2070.Shop Assistant,,"Ok, but our microvave is broken so it cannot be warmed.",
SAY.Chapter1.2074.Protagonist,,"It doesn't really matter, just give me the cold one.",
SAY.Chapter1.2072.Shop Assistant,,"Hey, you only can get your food after you pay for it.",
SAY.Chapter1.2073.Protagonist,,Ehhh...... Sorry I don't have enough money.,
SAY.Chapter1.2108.Protagonist,,May I have that chocolate.,
SAY.Chapter1.2109.Shop Assistant,,"Take it, that is also one of my favorite, you have a good taste.",
SAY.Chapter1.2110.Protagonist,,{i}( Guess that chocolate must be a big deal for them){/i},
SAY.Chapter1.2113.,,New Item:\nYou bought a box of chocolate.\n,
SAY.Chapter1.2116.Protagonist,,Why this chocolate is that expensive?,
SAY.Chapter1.2117.Shop Assistant,,"I don't know, the school decide the price, not me.",
SAY.Chapter1.2094.Protagonist,,"I want this postcard, please.",
SAY.Chapter1.2095.Shop Assistant,,You only want to buy one? We have different type of it.,
SAY.Chapter1.2102.Protagonist,,"No, one is enough.",
SAY.Chapter1.2100.,,New Item:\nYou bought a postcard.\n,
SAY.Chapter1.2098.Protagonist,,May I take it free? I don't have any money.,
SAY.Chapter1.2097.Shop Assistant,,"Get out, we are not charity.",
SAY.Chapter1.2123.Protagonist,,May I have that pack of cigarette?,
SAY.Chapter1.2124.Shop Assistant,,I can sell you it but we are tobaco free school.,
SAY.Chapter1.2125.Protagonist,,{i}( What is the meaning of selling cigaretter in tobaco free school? ){/i},
SAY.Chapter1.2128.,,New Item:\nYou bought a pack of cigarette.\n,
SAY.Chapter1.2131.Protagonist,,"Please, I really need that cigarette.",
SAY.Chapter1.2132.Shop Assistant,,Say that to your poor pocket.,
SAY.Chapter1.2164.Protagonist,,All the students are not straight related to Rebecca. I guess her own classmates are hard to come since the case passed two years ago.,
SAY.Chapter1.2292.Protagonist,,"Fine, anyway what the editor asks is just rumor, so maybe I am in a good path.",
SAY.Chapter1.2291.Protagonist,,"Wait a moment......That girl, is she Rebecca's twin sister?",
SAY.Chapter1.2165.Protagonist,,"They looks almost exactly the same, how could it possible?",
SAY.Chapter1.2166.Protagonist,,I need to approach her. She should be around now.,
SAY.Chapter1.2169.,,"Mission: ""Find the girl who looks similar to Rebecca.""",
SAY.Chapter1.2171.Protagonist,,Hey! You! Please wait a moment!,
SAY.Chapter1.2172.Protagonist,,Oh god she moves so fast. I am a little bit regret that I gave up going to the gym since high school.,
SAY.Chapter1.2173.Protagonist,,"Anyway, she should still on campus. I won't leave YIT today until I find her.",
SAY.Chapter1.2180.Protagonist,,{i}(A smell of smoke makes me feel sick. ){/i},
SAY.Chapter1.2182.Protagonist,, {i}(Who are smoking inside the building?  Is the fire alarm broken?){/i},
SAY.Chapter1.2225.Dina,,I know you are following me. And I know what you're thinking so just stop it.\n,
SAY.Chapter1.2222.Protagonist,,{i}( She's as suspicious as everyone else on this campus. Don't they realise this just makes me even more curious about Rebecca?){/i}\n,
SAY.Chapter1.2224.Protagonist,,"I'm so sorry! I'm no stalker, I promise. I was only curious -\n",
SAY.Chapter1.2223.Dina,,Why I look so much like Rebecca? I've heard that before…\n,
SAY.Chapter1.2226.Protagonist,,"Sorry, it's hard to ignore. The resemblance is really uncanny. I even briefly thought I was seeing Rebecca, alive and well.\n",
SAY.Chapter1.2227.Dina,,God that's depressing. Everyone looking at me and still thinking of her…\n,
SAY.Chapter1.2228.Protagonist,,You knew Rebecca well?\n,
SAY.Chapter1.2229.Dina,,It's none of your business. Why are you even asking me questions about all this?\n,
SAY.Chapter1.2230.Protagonist,,Well -\n,
SAY.Chapter1.2221.Dina,,Who even are you? Do you even go here? Let me see your student ID.\n,
SAY.Chapter1.2231.Protagonist,,"{i} Seriously, I hate having to lie, but would she trust me if I was actually honest?{/i}\n",
MENU.Chapter1.2234,,I'm a former student of Professor Rochester's. I was coming back to see him.\n,
MENU.Chapter1.2235,,Look - I'm writing a story about Rebecca.\n,
SAY.Chapter1.2254.Protagonist,,I did my undergrad here but a long time ago. I don't think I ever overlapped with your's and Rebecca's year.\n,
SAY.Chapter1.2237.Dina,,Oh. Sorry. I guess that was kinda rude of me to demand your ID wasn’t it?\n,
SAY.Chapter1.2239.Dina,,My name's Dina. I… I used to be Rebecca's roommate. \n,
SAY.Chapter1.2732.Dina,,I was just with Professor Rochester actually. We're all in a bit of shock about him resigning over this case.\n,
SAY.Chapter1.2238.Protagonist,,"That's awful. I mean, without him, I would never have made the progress I did at school here.\n",
SAY.Chapter1.2255.Dina,,Tell me about it. \n,
SAY.Chapter1.2733.Dina,,I suppose none of us are ever gonna wake up from Rebecca's nightmare.\n,
SAY.Chapter1.2256.Protagonist,,I'm sure we will. We've all just gotta keep looking forward.\n,
SAY.Chapter1.2257.Dina,,I wish Professor Rochester thought that way too. \n,
SAY.Chapter1.2734.Dina,,"I'm sorry, I need to go. Hope all goes well with the professor. Sorry again for being rude.\n",
SAY.Chapter1.2258.Protagonist,,It's okay. Take care.\n,
SAY.Chapter1.2272.Protagonist,,"I'm not here looking for gossip or anything like that, I really want to get to know about Rebecca -\n",
SAY.Chapter1.2273.Dina,,Most of the 'journalists' said the same two years ago. You're no different.\n,
SAY.Chapter1.2276.Dina,,Lie to get close to us. Lie that you care. All for an eye catching story you can make your name on.\n,
SAY.Chapter1.2277.Protagonist,,I don't think that's very fair. I'm trying to be honest with you -\n,
SAY.Chapter1.2278.Dina,,"None of you are honest! You don't care about what really happened, about Rebecca, or Antony or anyone in this school! You just want your 'big story'!\n",
SAY.Chapter1.2287.Dina,,"Don't follow me, or I will call security.\n",
SAY.Chapter1.2269.Protagonist,,"All the buildings are at another side of this street. If I want to cross the road, I need to find a {color=red}zebra crossing{/color}.",
SAY.Chapter1.2296.Protagonist,,"Hall of fame, only the most outstangding students could on it. A typical symbol of hierarchy. Maybe Rebecca should on it.",
SAY.Chapter1.2349.Protagonist,,It's already 8 P.M. Guess I need to go back otherwise I would miss the last bus.,
SAY.Chapter1.2350.Protagonist,,But before that I need to find somewhere to organize what I learnt today. Maybe that {color=red}construction entrance{/color} can be a good place.,
SAY.Chapter1.2351.,,"Mission: ""Go to the construction entrance to make today's conclusion.""",
