Key,Description,Standard,EN
SAY.Chapter1.969.Sophie,,目前我没有更多消息可以告知。假如您没有什么要紧的事，我就要去继续工作了。,"I have no more news to tell at this time. If you have nothing important, I'm going to continue working."
SAY.Chapter1.1027.Protagonist,,听说你们是跟校方多次交涉才得到了举办权，看来是花费了许多时间和精力，没想到大学生还有这样的组织能力，真是令人惊叹。,I heard that you got the right to host after several negotiations with the school. It took a lot of time and energy. I didn't expect college students to have such organizational skills. It is really amazing.
SAY.Chapter1.1021.Sophie,,您过奖了，没有那么厉害。而且大部分都是学姐的父亲Rochester教授在与学校谈判，我们只不过是帮一些微不足道的忙而已。,"Thank you, it's not that great. And most of negotiation was made by Professor Rochester, Rebecca's father, we are just helping."
SAY.Chapter1.1028.Protagonist,,没想到老师会对学生举办的活动投入心血。,"Unexpectedly, the teacher would devote himself to the activities organized by the students."
SAY.Chapter1.1029.Sophie,,毕竟事关他的亲生女儿，我想也是人之常情。,"After all, it is about his daughter."
SAY.Chapter1.1030.Sophie,,况且Rochester教授因为女儿的事情也跟学校起过不少争执，现在他也没有必要再看学校眼色了。,"Besides, Professor Rochester had a lot of disputes with the school because of his daughter's affairs, and now he doesn't need to care about the school anymore."
SAY.Chapter1.1031.Protagonist,,这是怎么一回事？难道教授与学校之间发生了什么不愉快的事？,What's going on? Did something unpleasant happen between the professor and the school?
SAY.Chapter1.1032.Sophie,,本来学校是打算趁着暑假悄悄填湖，但教授提出来必须让他先祭奠一下学姐，并主动提出自己辞去行政职务，不再给学校添麻烦。,"Originally, the school planned to fill the lake quietly during the summer vacation, but the professor suggested that he must first pay a memorial to Rebecca, and decided to resign from the dean position so as not to cause trouble to the school."
SAY.Chapter1.1053.,,New Info:\nRobert sacrified his career to hold this event.,New Info:\nRobert sacrified his career to hold this event.
SAY.Chapter1.1033.Protagonist,,作为一个父亲，做出这样的举动也是情理之中。,"As a father, it is reasonable to make such a move."
SAY.Chapter1.1034.Sophie,,是啊，学校就这样失去了一位好老师，不知道以后学院会变成什么样子。,"Yes, the school just lost a good teacher. I don't know what the school will become in the future."
SAY.Chapter1.1035.Sophie,,这场悲剧，毁掉的可不止是一条性命。,This tragedy has destroyed more than one life.
SAY.Chapter1.1213.Protagonist,,为什么大家说的跟你的表述不太一样？似乎大家还是更愿意相信这就是一场意外。,Why is what everyone said is different from what you said? It seems that everyone is still more willing to believe that this was an accident.
SAY.Chapter1.1214.Sophie,,大家这么说了吗？也不怪他们，毕竟不这么说的后果挺严重。,"Did everyone say that? Don't blame them, after all, the consequences of not saying that are quite serious."
SAY.Chapter1.1215.Protagonist,,会有什么后果？,What are the consequences?
SAY.Chapter1.1216.Sophie,,两年前学校就下过命令，让学生不要乱传流言，一切以学校公告为准。,"The school issued an order two years ago to keep students from spreading rumors, and the school's announcement should represent the attitude of all students.."
SAY.Chapter1.1217.Sophie,,如果学生被发现表达了不同观点，会被以散播谣言与诋毁学校名声为理由开除。,"If a student is found to express a different point of view, they will be expelled on the grounds of spreading rumors and discrediting the school."
SAY.Chapter1.1218.Sophie,,尤其不能未经允许接受警方盘问，说了什么做了什么都要有辅导员陪同。,"In particular, you cannot accept police cross-examination without permission, and you must be accompanied by a counselor for everything you say and do."
SAY.Chapter1.1250.,,New Info:\nThe university has restricted students' speech.,New Info:\nThe university has restricted students' speech.
SAY.Chapter1.1219.Protagonist,,所以这就是你之前所说的“压力”？,"So this is what you called ""stress"" before?"
SAY.Chapter1.1220.Sophie,,是的，我们也只能用捐款活动这种暗示来间接表达抗议。,"Yes, we can only use the hint of donation activities to express protest indirectly."
MENU.Chapter1.1222,,你们真的非常具有勇气，挑战权威很不容易。,Challenging authority is not easy.
MENU.Chapter1.1223,,你们一定要保护好自己，不要引火上身。,Don't get into trouble.
SAY.Chapter1.986.Anonymous Student,,I dunno. All I know is it took a lot of time to set up.\n,
SAY.Chapter1.987.Anonymous Student,,"My friend's been planning it since the start of the semester. There was so much to negotiate with the school, they went back and forth over it.\n","At least my classmates have been planning since the beginning of this semester, and they made a lot of negotiations with the school."
SAY.Chapter1.995.,,.New Info:\nSounds like there might be some disagreements between the school and the students.\n,New Info:\nStudents have argued with the school multiple times.
SAY.Chapter1.988.Protagonist,,Well the fact you've managed to make something like this happen is really impressive. I'm sure no one will forget Rebecca soon after this.\n,"This is really an impressive activity, and for you, it will be an unforgettable memory during college."
SAY.Chapter1.1038.Protagonist,,收集到了一些新线索，要不要找之前卖花的学生问下她的观点？还是继续探索？,I have collected some new clues. Asking the student who sold flowers about her point of view? Or continue to explore?
SAY.Chapter1.1001.Protagonist,,How did you get the organisational and financial support to bring everything together for an event of this scale?\n,"Can students have the right to hold such a large-scale mourning event? Including concession venues, buying bouquets, contacting anti-PUA organizations and making donations?"
SAY.Chapter1.1002.Anonymous Student,,"Yeah like 90% of it was done by students. I mean, we were all hit hard by Rebecca's death you know? She was one of us.\n","90% was organized spontaneously by students. After all, Rebecca's death is a pity for any of us."
SAY.Chapter1.1003.Anonymous Student,,"But we definitely have to thank Professor Rochester too. If he hadn't stepped in, none of this would've happened.\n","But in the end, we should thank Professor Rochester the most. If he hadn’t negotiated with the school, I’m afraid we would not be able to hold this event."
SAY.Chapter1.1004.Protagonist,,Professor Rochester? \n,Professor Rochester? This last name sounds familiar...
SAY.Chapter1.1005.Anonymous Student,,"Yeah, he's Rebecca's dad. Used to be the dean of the business school too. We got most of the funding for today through him.\n",He is Rebecca's father and the former dean of our business school. Most of the funds for this event were sponsored by him.
SAY.Chapter1.1008.,,New Info:\nRebecca's father used to be the department dean.\n,New Info:\nRebecca's father used to be the department dean.
SAY.Chapter1.1014.Protagonist,,Thanks for answering my questions. \n,"I see. I hope that the event can be successfully held, so that everyone can graduate without regret."
SAY.Chapter1.1040.Protagonist,,I've found a lot of interesting information here. Maybe it could be the key of some new topics.\n,I have collected some new clues. Asking the student who sold flowers about her point of view? Or continue to explore?
SAY.Chapter1.1055.Protagonist,,Are you also here to remember Rebecca?\n,"Hi, are you here to mourn Rebecca too?"
SAY.Chapter1.1056.Anonymous Student,,No I was just stopping by. Mind if I ask who you are? I don't think I've seen you around.\n,"No, I just passed by and stopped by to take a look, who are you?"
SAY.Chapter1.1057.Protagonist,,"Why is she so suspicious? I should make something up, quick…\n","I am a school newspaper journalist, and I am going to write a special report on this event. Can you tell me about Rebecca in your eyes?"
SAY.Chapter1.2779.Protagonist,,I'm writing this up for the school newspaper. Could you tell me what you knew about Rebecca?\n,
SAY.Chapter1.1058.Anonymous Student,,Since when did the school have a newspaper?\n,"School newspaper? Strange, our school has never had a school newspaper."
MENU.Chapter1.1062,,It was only recently founded. \n,It was only founded this month.
MENU.Chapter1.1063,,"We've only got a couple of us running it, and all of us are very new to it.\n",Just a small organization with single-digit members.
SAY.Chapter1.1121.Protagonist,,Can we continue the unfinished conversation? Like why Rebecca has so many privileges on campus?,Can we continue to talk about topics we haven't finished talking about before? About why Rebecca can help so many students?
SAY.Chapter1.1122.Anonymous Student,,Can you explain it more specifically?,"What do you mean? Sorry, I don’t remember much of what we talked about."
SAY.Chapter1.1123.Protagonist,,{i}（Is there any information I could find in my notebook？）{/i},{i}(Is there any relevant information that I can talk about?){/i}
SAY.Chapter1.1068.Anonymous Student,,"Oh, so you're a freshman? No wonder you're asking about Rebecca…\n",Freshman? No wonder you are not very familiar with Rebecca.
SAY.Chapter1.2780.Protagonist,,Would you be willing to talk about her? \n,
SAY.Chapter1.1069.Anonymous Student,,"If you're unsure, we could keep it anonymous?\n",Can I request an interview anonymously?
SAY.Chapter1.1070.Anonymous Student,,I always saw Rebecca as the school diva to be honest.\n,"Generally speaking, Rebecca is a school diva of our time."
SAY.Chapter1.1071.Protagonist,,How do you mean?\n,Can you be more specific?
SAY.Chapter1.1072.Anonymous Student,,"She was always the center of attention, both with students and even the faculty.\n","Whether it is between teachers or students, she is an irreplaceable focus, an absolute center of the community."
SAY.Chapter1.1073.Anonymous Student,,"When she was in that competition, the building was plastered with her face, like she was running for office or something.\n","When she represented the school in the national competition, the school building was filled with her propaganda posters, making it almost like the president election."
SAY.Chapter1.1075.Protagonist,,Sounds like they pulled out all the stops for her.\n,It sounds like a grand event.
SAY.Chapter1.1076.Anonymous Student,,Oh yes. Nothing was too much for the school princess.\n,"Yes, the scenery is fancy, and even too fancy, like she is the princess."
SAY.Chapter1.1074.Protagonist,,No wonder everyone misses her still.\n,No wonder everyone still misses her after so long.
SAY.Chapter1.1077.Anonymous Student,,"Miss her? To be honest, apart from her closest friends and fans, I think most just miss the extra classwork help she was always offering.\n","Miss? I think that apart from the few Rebecca fanatics, everyone else is just a pity that they are missing a schoolgirl who is addicted of helping them solve their troubles."
MENU.Chapter1.1078,,I haven't heard anyone say something like that about Rebecca so far.\n,It seems that she is not the perfect person as others say.
MENU.Chapter1.1079,,Are you saying people's sorrow isn't genuine? Even here?\n,"There is no need to be so mean, everyone should be really sad."
SAY.Chapter1.1084.Anonymous Student,,I'm just saying that you have to be someone really special to have people turn out like this. University life isn't as innocent as you might think.\n,"You freshmen still don't know that society is sinister. If a person has no special value, then she will certainly not be sought after by everyone."
SAY.Chapter1.1085.Protagonist,,{i}(Interesting point - how was Rebecca capable of helping so many students?){/i}\n,"{i}(True, if Rebecca is just an ordinary student, is she capable of helping so many students?){/i}"
SAY.Chapter1.1086.Protagonist,,{i}(Is there any other relevant information that I could ask them about?){/i}\n,{i}(Is there any relevant information that I can talk about?){/i}
SAY.Chapter1.1111.Protagonist,,Would you say this is also about Rebecca?\n,Is this information about Rebecca?
SAY.Chapter1.1110.Anonymous Student,,"I have no idea what this is, sorry. Sounds like idle gossip.\n","I am not interested in this, nor do I want to gossip about the dead."
SAY.Chapter1.1112.Anonymous Student,,"If everyone else is saying they miss her, who am I to disagree?\n","As long as everyone shows that they miss her, let this be the only fact."
SAY.Chapter1.1113.Anonymous Student,,I don't know. Maybe someone else does?\n,"I have nothing to say, please find someone else."
SAY.Chapter1.1115.Protagonist,,I heard that Rebecca's father used to be the dean of the business school. Is that right?\n,"I heard that Rebecca's father used to be the dean of the business school, right?"
SAY.Chapter1.1116.Anonymous Student,,Yeah he was. To her advantage as well I'd say.\n,"That's right. If you want me to say, she got a lot of benefits by having a dean as a father."
SAY.Chapter1.1117.Protagonist,,You think the dean being her father gave her special privileges?\n,"But even if her father used to be the dean, it cannot prove that she has special rights."
SAY.Chapter1.1118.Anonymous Student,,"I mean, if it didn't, why did everyone always turn to her for help?\n","If she doesn't, why do students go to her for help instead of someone else?"
SAY.Chapter1.1139.,,New Info:\nRebecca might have used her father's position to help students.\n,New Info:\nRebecca used her father's power to help students.
SAY.Chapter1.1119.Anonymous Student,,I mean whether you believe me or not is up to you. Maybe I'm just jealous of the school princess….\n,"Of course, believe it or not, it's up to you. Maybe it's just I am jealous of her brilliant experience."
SAY.Chapter1.1160.Protagonist,,Excuse me - could I maybe talk with you for a moment?\n,Please wait a moment! I want to ask what happened here?
SAY.Chapter1.1161.Anonymous Student,,"What about? I've not got long, I've got to leave in a moment.\n","I am very busy, what would you like to ask?"
SAY.Chapter1.1162.Protagonist,,"Oh I'm doing a report on the memorial and wanted to hear from the students, it shouldn't take long. Did you know Rebecca?\n","I'm doing a report on this event, and I need to know the students' views. Do you know Rebecca?"
SAY.Chapter1.1163.Anonymous Student,,Only a little bit. I wasn't very close with her.\n,"I know a little bit, but we are not very familiar."
SAY.Chapter1.1164.Protagonist,,What do you know about Rebecca's accident?\n,Can I ask what you think about Rebecca's accident?
SAY.Chapter1.1165.Anonymous Student,,Nothing much. It was just pure bad luck. I guess it could've happened to anyone really.\n,"I... don't have any special thoughts, just an unfortunate accident. We all deeply regret it."
SAY.Chapter1.1166.Protagonist,,What do you think might have caused it?\n,Do you know the cause of the incident?
SAY.Chapter1.1167.Anonymous Student,, I don't know. What causes an 'accident'?\n,"Sorry, as far as I know, Rebecca's incident was just an accident, and I don't know anything else."
SAY.Chapter1.1168.Protagonist,,{i}(He doesn't seem to want to talk much. Is there something I could show him? Maybe ask something more specific?){/i}\n,{i}(Should I show something? Ask more specific?){/i}
SAY.Chapter1.1182.Protagonist,,Is this related to Rebecca do you think?\n,Do you know this information about Rebecca?
SAY.Chapter1.1183.Anonymous Student,,I wasn't familiar enough  with her to know.\n,"My relationship with her is just same school students, not very familiar."
SAY.Chapter1.1185.Anonymous Student,,I'm sure the organizers of the memorial might know more than I do. You should talk to them.\n,
SAY.Chapter1.1184.Anonymous Student,,Sorry that I can't help more.\n,Sorry for not being able to help you. Please ask someone else.
SAY.Chapter1.1187.Protagonist,,What do you think is the school's attitude to all this?\n,Do you know the school's attitude towards this matter?
SAY.Chapter1.1188.Anonymous Student,,"I mean they said it's an accident, so clearly they think it's an accident? \n","Can you let me go? The school has already said that it is an accident, and that is an accident."
SAY.Chapter1.1189.Anonymous Student,,"I don't want to get stuck in any conspiracy theories about it. Look, I've really got to go -\n","We only know these. If I said some gossip that was spreading out to everywhere, the impact on the school was not good."
SAY.Chapter1.1190.Protagonist,,I don't mean that. It's just some other students have implied…\n,"I didn’t mean that, but other students revealed..."
MENU.Chapter1.1193,,That the school has been too quick to call it an accident.\n,The school wants to cover up the incident as an accident.
MENU.Chapter1.1194,,That her death might not have been an accident at all.\n,Rebecca's death was not a pure accident.
SAY.Chapter1.1197.Anonymous Student,,I'm not in control of what other people say. \n,"I can't control what other people say, but I can't say unfounded words."
SAY.Chapter1.1198.Anonymous Student,,But it sounds ridiculous to me. What would YIT gain by acting like this?\n,Who knows if someone with ulterior motives fabricated it to discredit our school?
SAY.Chapter1.1209.,,New Info:\nSome students still believe that the case is an accident.\n,New Info:\nSome students insist that the case is an accident.
SAY.Chapter1.1199.Anonymous Student,,"I have to go. If you're talking to other students, can you not bring up all this gossip? It's upsetting.\n","I won’t say more about it, please stop spreading these gossips."
SAY.Chapter1.1232.Sophie,,我们已经做好了最坏的打算。比起什么都不做带着遗憾毕业，至少现在我们的良心不会受到谴责。,"We have prepared for the worst. Compared to graduation with the regret of doing nothing, at least now our conscience will not be condemned."
SAY.Chapter1.1236.Sophie,,总之，谢谢您对这件事情如此关心，说明我们的宣传是有成效的。,"In short, thank you for your interest in this matter, which shows that our publicity is effective."
SAY.Chapter1.1265.Protagonist,,您好，您曾经是Rebecca的老师吗？,"Hello, have you ever been Rebecca's teacher?"
SAY.Chapter1.1266.Robert,,老师吗？这么说也没有问题。,Teacher? This title should make sense.
SAY.Chapter1.1267.Protagonist,,{i}（为什么要用疑问句？难道还有其他的可能性){/i},{i}(Why question first? Are there other possibilities){/i}
MENU.Chapter1.1271,,难道您与她有师生以外的关系？,Are you someone else instead of teacher?
MENU.Chapter1.1272,,您是代表学校来纪念Rebecca的吗？,Are you mourning Rebecca on behalf of the school?
SAY.Chapter1.1295.Protagonist,,Robert教授，有些事情我还想请教。,"Professor Robert, there are some things I would like to ask."
SAY.Chapter1.1296.Robert,,请说，只要是你问的内容有价值我都会回答的。,"Please say, as long as the content you ask is valuable, I will answer it."
SAY.Chapter1.1297.Protagonist,,{i}（我有有价值的议题能展开探讨吗？）{/i},{i}(Can I discuss something worthwhile?){/i}
SAY.Chapter1.1274.Robert,,我想我站在这里，更多是作为父亲的立场。,"I think I stand here, more as a father."
SAY.Chapter1.1275.Protagonist,,您就是Rochester教授吗？久仰大名。,Are you Professor Rochester? One of the most famous professor of YIT?
SAY.Chapter1.1278.Robert,,看来你的调查相当的顺利，短短时间已经掌握了不少资料。,"It seems that your investigation went well, and you have mastered a lot of information in a short period of time."
SAY.Chapter1.1279.Protagonist,,{i}！（糟糕，被识破了吗？){/i},"{i}! (Oops, did he already know my purpose?){/i}"
MENU.Chapter1.1282,,您在说什么，我听不懂？调查什么？,What to investigate? I don't understand? 
MENU.Chapter1.1283,,我只是路过来祭拜的学生而已。,I'm just a student who came by to mourn.
SAY.Chapter1.1286.Robert,,我当了三十多年的老师，什么样的人是学生还是辨别的出来。,I have been a teacher for more than 30 years. I can still tell who is a student.
SAY.Chapter1.1288.Robert,,至少现在，在Rebecca的面前，请不要对我说谎。,"At least for now, in front of Rebecca, please don't lie to me."
SAY.Chapter1.1287.Protagonist,,我不是什么可疑人士，请不要把我赶走。,"I am not a suspicious person, please don't drive me away."
SAY.Chapter1.1289.Robert,,放心吧，你以为这两年来找我调查的人就少吗？没想到我最后一次出名居然是因为女儿的死亡。,"Don't worry, do you think that how much people have come to me for investigation in the past two years? Unexpectedly, the last time I became famous was because of the death of my daughter."
SAY.Chapter1.1290.Robert,,我不会立刻赶你走，只要你接下来实话实说。我教过的学生成千上百，诚信是我们做学术的基本。,"I won't drive you away right away, as long as you tell the truth next. I have taught hundreds of students and honesty is the basis of academic attitude."
SAY.Chapter1.1291.Protagonist,,实话实说？您想要知道些什么？,Be honest? What do you want to know?
SAY.Chapter1.1292.Robert,,关于Rebecca，她的死因。,"About Rebecca, the cause of her death."
SAY.Chapter1.1293.Robert,,如果你真的做了全面的调查，现在心中应该已经有一个初步的答案了，我想听听你的看法。,"If you really did a comprehensive investigation, you should have a preliminary answer in your mind now. I want to hear your opinion."
MENU.Chapter1.1313,,我想这是一场不幸的意外。,This was an unfortunate accident.
MENU.Chapter1.1314,,我想您的女儿可能遭受了某种人格控制。,Your daughter may have suffered personality control.
SAY.Chapter1.1368.Protagonist,,您知道关于Rebecca得这个信息吗？,Do you know this information about Rebecca?
SAY.Chapter1.1369.Robert,,我不认为这个信息有任何研究价值。,I don't think this information has any research value.
SAY.Chapter1.1370.Robert,,或许你需要再仔细审阅一下自己的研究成果。,Maybe you need to carefully review your own research results.
SAY.Chapter1.1372.Protagonist,,Rebecca真的是一位十分优秀的女性，您的教育非常成功。,"Rebecca is really a brilliant girl, and your education is very successful."
SAY.Chapter1.1373.Robert,,谢谢你的夸赞，可是比起死后得虚名，我更希望此刻她活着，哪怕普普通通。,"Thank you for your compliment, but rather than getting a reputation after death, I hope she is alive at this moment, even ordinary."
SAY.Chapter1.1374.Robert,,更何况有时候优秀并不是优势，反而是对精神的一种桎梏。,"What's more, sometimes being excellent is not an advantage, but a weakness."
SAY.Chapter1.1375.Protagonist,,这是什么意思？优秀反而会成为缺点吗？,What does it mean? Will excellence be a disadvantage instead?
SAY.Chapter1.1376.Robert,,或许这么说是有一些荒谬，但是我想Rebecca也一定觉得非常累吧，当这样一个优秀的人。,"Maybe it is absurd to say that, but I think Rebecca must feel very tired too, being such an excellent person."
SAY.Chapter1.1377.Protagonist,,（说的好深奥，不愧是名教师。虽然我不太听得懂这个理论。）,{i}(It’s so esoteric. Although I don’t quite understand this theory.){/i}
SAY.Chapter1.1381.Protagonist,,您真的不觉得您女儿的死没有什么蹊跷？,Do you really think there is nothing strange about your daughter's death?
SAY.Chapter1.1382.Robert,,我认为存在蹊跷，只是现阶段大家流传的版本都不是真相。,"I think there is something wrong, but the version circulated by everyone at this stage is not the truth."
SAY.Chapter1.1383.Robert,,至少没有绝对证据证明他们是可信的。,At least there is no absolute evidence that they are credible.
SAY.Chapter1.1384.Robert,,我不允许自己的女儿死的糊里糊涂。,I don't allow my daughter to die in confusion.
SAY.Chapter1.1387.Protagonist,,听说Rebecca是借您的权力来帮助其他学生，这样真的好吗？,I heard that Rebecca borrowed your power to help other students. Is this really appropriate?
SAY.Chapter1.1388.Robert,,你有听到这样的传言吗？这么说并不准确。,Have you heard such rumors? This is not accurate.
SAY.Chapter1.1389.Robert,,Rebecca从来没有主动来求过我，都是我举手之劳而已。,"Rebecca never took the initiative to beg me, it was all my pleasure."
SAY.Chapter1.1390.Protagonist,,为什么？我相信以她的能力应该可以自己解决。,"Why? I believe that with her ability, she should be able to solve it by herself."
SAY.Chapter1.1391.Robert,,或许可以吧。但需要她费时费力才能完成的事我只要几分钟就能完成，何必让她浪费这个时间呢？,"Maybe it can. But I can do things that require her time and effort to complete in just a few minutes, so why let her waste this time?"
SAY.Chapter1.1392.Robert,,不过都是些细枝末节的小事，父亲帮一帮女儿，我觉得无可厚非。,But it's all trivial things. I think it's understandable that father helps daughter.
