Key,Description,Standard,EN
SAY.Chapter1.19.Sophie,,"Hi, are you here for the Class of 2020 Memorial Service?\n","Hi, are you here to join the “ Happy Graduate, Rebecca♥” memorial service?"
SAY.Chapter1.430.Protagonist,,"{i}(Ah, that black and white photo must be of Rebecca. I should've guessed.){/i}\n","{i}(It turns out that the black and white portrait is Rebecca, the victim of the love murder case.){/i}"
SAY.Chapter1.449.Sophie,,"We're commemorating Rebecca Rochester, who sadly passed away two years ago this week. \n","This event commemorates our deceased classmate, Rebecca Rochester. Would you like to hear the details?"
MENU.Chapter1.432,,I'm so sorry to hear. Were you close with her?\n,"Please tell me more, do you know Rebecca?"
MENU.Chapter1.446,,"I see. I'm here for something else, sorry.\n                                                                                                                                                                                                                                                                                                                                                                                                                                                                                                                                                                                                                                                                                                                                                                                                                                                                                                                                                                                                                                                                                                                                                                                                                                                                                                                                                                                                                                                                                                                                                                                                                                                                                                                                                                                                                                                                                                                                                                                                                                                                                                                                                                                                                                                                                                                                                                                                                                                                                                                                                                                                                                                                                                                                                                                                                                                                                                                                                                                                                    ","I'm not interested, sorry."
SAY.Chapter1.895.Sophie,,您找我还有什么事吗？如果您不买花的话我就先失陪了。,"Is there anything else you need from me? If you're not interested in buying flowers, I have other things to do."
MENU.Chapter1.898,,请等一下，我反复考虑决定还是买一束吧，希望你还有存货。,"Please wait a moment, I've decided to buy a bunch."
MENU.Chapter1.899,,算了，没事，你去忙吧,"Never mind, please go about your business."
SAY.Chapter1.907.Sophie,,还有什么我还可以帮到您的事情吗？,Is there anything else I can help you with?
SAY.Chapter1.908.Protagonist,,{i}（有什么疑问需要咨询吗？）{/i},{i}(Do I have any questions?){/i}
SAY.Chapter1.43.Protagonist,,Are you here for the memorial too?\n,"Hello, are you here to mourn Rebecca too?"
SAY.Chapter1.628.Anonymous Student,,"A friend is the host, so I just came along to help.\n","My classmate is the host, so I just came along to help."
SAY.Chapter1.629.Protagonist,,Do you mind if I ask you a few questions?\n,Can I ask you a few questions? I find this event very intriguing.
SAY.Chapter1.631.Anonymous Student,,"… as long as its nothing like personal or sensitive, I guess…\n","...If it is not a sensitive question, I should be able to answer it."
MENU.Chapter1.981,,Do you know if the school is supporting this memorial?\n,Does the school support you in holding this event?
MENU.Chapter1.982,,So was everything organised by students?\n,Is the entire event organized by the students?
SAY.Chapter1.1242.Protagonist,,这位同学，能再找你聊聊吗？,"Hi, can I ask something else?"
SAY.Chapter1.1243.Anonymous Student,,我能说的都已经说完了。,I have said all that I can.
SAY.Chapter1.1244.Anonymous Student,,请不要打扰我，我想独自一人怀念一下Rebecca。,"Please don't disturb me, I want to remember Rebecca alone."
SAY.Chapter1.1361.Bus Broadcast,,"We have arrived at YIT Bus Station, our final stop. Please use the rear doors to exit.\n",We have arrived at YIT station. Please use the rear doors to exit.
SAY.Chapter1.417.Protagonist,,"{i}June 20, 2020: On this fateful morning at YIT, one of the most prestigious universities in this city, the body of a young woman was discovered just before the annual graduation ceremony. The victim, Rebecca Rochester, had drowned.{/i}\n","{i}June 20, 2020: at YIT, the most prestigious university in this city, a drowned female body was discovered on campus during the morning of the annual graduation ceremony.{/i}"
SAY.Chapter1.418.Protagonist,,"{i}After initial investigations seemingly ruled out an accidental death, the police have charged Antony Sallin, Rebecca's boyfriend of two years, with her murder.{/i}\n","{i}After multiple investigations, the police identified a suspect: Antony Sallin, Rebecca's boyfriend of two years. They charged Sallin with intentional homicide.{/i}"
SAY.Chapter1.419.Protagonist,,I can feel those parents worry.,"{i}The police found pinch marks on the neck of Rebecca's body, with the circumference of an adult man's hand. They also located some of Rebecca's personal belongings, such as necklaces, in Antony's dormitory.{/i}"
SAY.Chapter1.420.Protagonist,," If my child died at age of 20 on campus, no matter accident or what, I might hate this society.","{i}A number of teachers testified that Antony and Rebecca met alone on the night of the crime, and no one could provide an alibi for him.{/i}"
SAY.Chapter1.421.Protagonist,,"This is also a serious scandal to the school, I wonder how much they paid to the victim's parents? But, no matter how much, the girl would not be back.","{i}According to anonymous comments from teachers and classmates, Antony maintained unstable and non-committal relationships with many female students.{/i}"
SAY.Chapter1.422.Protagonist,,"{i}Rebecca and Antony were known to have quarreled frequently, often in public, since the second semester of their junior year in 2019.{/i}\n",{i}Rebecca and Antony were known to have quarreled frequently aince the second semester of their junior year in 2019. Many students had witnessed disputes between the two sides.{/i}
SAY.Chapter1.423.Protagonist,,{i} The police believe Antony to have been engaging in a pattern of long term manipulative and potentially violent behavior towards Rebbeca. {/i}\n,{i}The police determined that Antony had long-term manipulative and potentially violent behavior towards Rebecca.{/i}
SAY.Chapter1.424.Protagonist,,"{i}However, on December 28,  Antony was ultimately acquitted and released due to insufficient and circumstantial evidence. Rebecca's death was finally declared to be an accident...{/i}\n","{i}On December 28,  Antony was acquitted and released due to insufficient evidence. The case was finally announced as an accident...{/i}"
SAY.Chapter1.750.Protagonist,,I'm surprised to hear he was acquitted. It sounds like there was such a strong case against him.\n,Acquitted? Such a person was finally announced as not guilty?
SAY.Chapter1.753.Protagonist,,"Since my editor thinks this case could inspire my own work, there must be more to it than meets the eye.\n","Since the editor thinks this case can be used as the inspiration for my new work, it seems that there should be some hidden information behind it."
SAY.Chapter1.1531.Protagonist,,This isn't relevant to the case.\n,"This is not useful information, find something else."
SAY.Chapter1.751.Protagonist,,"{i}June 21, 2022: YIT has recently decided to expand its campus,  lakeside home further developing its lakeside home next to its well renowned business school.{/i}\n","{i}June 21, 2022: YIT decided to expand its campus.Reportedly, the new campus site is planned for the lake area next to the business school.{/i}"
SAY.Chapter1.756.Protagonist,,This is yesterday's newspaper. It's been almost exactly two years since the incident.\n,Hmm... This is yesterday's newspaper. It's just over two years after the incident.
SAY.Chapter1.754.Protagonist,,This new construction work of theirs has really torn up the road round here. It's all mud and dirt.\n,"Because of construction work, the road around here has become thoroughly bumpy and muddy."
SAY.Chapter1.1576.Protagonist,,The school plans to name the new library in honour of Rebecca.\n,The school plans to name the new library in names of Rebecca.
SAY.Chapter1.755.Protagonist,,This smells like a cover-up to me… maybe there's some connection to the school's affairs?\n,
SAY.Chapter1.1589.Protagonist,,This isn't relevant to the case.\n,"This is not useful information, find something else."
SAY.Chapter1.1695.Protagonist,,Who wrote such mean words? At least show some respect to a dead person.,
SAY.Chapter1.1696.Protagonist,,And why it called Rebecca as thief? That is a serious accusion.,
SAY.Chapter1.1697.Protagonist,,"Maybe is just some students who are jealous of her? But still, this is too much.",
SAY.Chapter1.1700.,,New Info:\nSomeone in school is still hating Rebecca.,
SAY.Chapter1.1703.Protagonist,,Looks like someone still believe Antony is innocent.,
SAY.Chapter1.1704.Protagonist,,This person must know some important evidence to be against the majority's opinion. I wish I could find who wrote this.,
SAY.Chapter1.1707.,,New Info:\nSomeone ensure that Antony is innocent.,
SAY.Chapter1.2289.Protagonist,,"An ordinary wish to Rebecca, looks like everyone still loves her.",
SAY.Chapter1.2304.Protagonist,,Ah ha! I knew she is on it. She really got every honor a student can get in school.,
SAY.Chapter1.2305.Protagonist,,But she only won the second runner up place. {color=red}Is it qualified enough to be on the hall of Fame{/color}? ,
SAY.Chapter1.2306.Protagonist,,"I remember back to my time, only one student per year can be put on hall of fame.",
SAY.Chapter1.2309.,,New Info:\nRebecca won the second runner up in a global competition.,
SAY.Chapter1.2314.Protagonist,,Emm.......The President Scholarship is very hard to apply. It requires a GPA above 3.9 and a really long personal statement to explain why you need scholarship.,
SAY.Chapter1.2315.Protagonist,,"This Maggie should be {color=ren}an extremely clever student{/color}. She is from the same class as Rebecca, is there anyway II can get in touch with her?",
SAY.Chapter1.2318.,,New Info:\nMaggie Gothem is another oustanding student in Rebecca's class.,
SAY.Chapter1.2323.Protagonist,,"I used to call Hall of fame as Hall of lame, because I cannot be one of them.",
SAY.Chapter1.462.Sophie,,"Not personally, but we all chose her as the representative of the class of 2020 - she really was the best of us, both an excellent student and a kind and caring friend.\n","Rebecca is the representative of YIT's graduating class of 2020. During her time at school, she wasn't just an excellent student; she also treated her classmates kindly and tenderly."
SAY.Chapter1.463.Sophie,,"She was always there to help anyone struggling with their grades, whenever they needed her.\n","If students in lower grades had any trouble, she'd take it on herself to help out in any way she could."
SAY.Chapter1.859.,,New Info:\nRebecca had a good reputation among students.\n,New Info:\nRebecca has a good reputation among students.
SAY.Chapter1.502.Sophie,,"Unfortunately, two years ago, the night before graduation, she had an accident and left us forever.\n","Unfortunately, two years ago, on the night before graduation, she had an accident and left us forever."
MENU.Chapter1.811,,听起来是一个前途无量的学生。,She sounds like she was an exemplary student.
MENU.Chapter1.813,,你好像很喜欢她。,You seem to have admired her very much.
SAY.Chapter1.601.Sophie,,"Don't you want to pay your respects to a brilliant young woman, taken before her time?\n","Don't you have any sympathy for this outstanding girl, known for her winning personality, who lost her life at such young age?"
SAY.Chapter1.602.Protagonist,,I'm afraid I've never even heard of her.\n,"No... You see, I didn't even know her."
SAY.Chapter1.605.Sophie,,Really? Her name and the stories of what happened were all over social media for a really long time.\n,"At the  time, there were a lot of rumors on social media.But you didn't know anything about it?"
SAY.Chapter1.606.Protagonist,,{i} (If I paid more attention to social media I'd probably have a better idea of what's going on here.) {/i}\n,{i} (I really don’t pay much attention to quarrels on the Internet.) {/i}
SAY.Chapter1.607.Protagonist,,What did happen here?\n,"Okay, so what happened here?"
SAY.Chapter1.489.Sophie,,谢谢，这是您的花束！Rebecca学姐在天之灵会保佑您的。,
SAY.Chapter1.490.Sophie,,听起来有点恐怖。,Sounds like a horror movie.
SAY.Chapter1.497.,,New Item:\nYou got a bunch of flowers.\n,New Item:\nYou got a bunch of flowers.\n
SAY.Chapter1.495.Protagonist,,不过，看在我已经买了花的份上，你可以回答我Rebecca的死到底跟PUA有什么关系吗？,I already bought the flowers. Can you tell me whether Rebecca's death had anything to do with PUAs?
SAY.Chapter1.504.Sophie,,……其实并没有什么太大联系，我们只是想借此引起社会对此的重视而已。,"...to be honest, there is not much connection. We just wanted to raise awareness of this problem in society..."
SAY.Chapter1.870.Protagonist,,既然没有关系，为什么要特地在Rebecca的悼念会上进行捐款活动，难道你们是在蹭热度、诈骗捐款？\n,"If it doesn't matter, why  are you fundraising at Rebecca's memorial service? Are you scamming donations? \n"
SAY.Chapter1.871.Protagonist,,嘴上说着感谢学姐，实际却利用学姐赚钱。,You're making money off of Rebecca's death while pretending to miss her.
SAY.Chapter1.505.Sophie,,你这个人，说话怎么这么难听，我们可是毫无私心。,How rude! Our intentions aren't selfish.
SAY.Chapter1.872.Sophie,,如果能够有机会，我们都想报答她，她生前帮助我们许多。那一天后，我们所有人，都后悔着没有来得及对她道谢。,"Given the opportunity, we'd want to express our gratitude. She helped us a lot when she was still with us. After the tragedy, we all regretted not taking the time to thank her."
SAY.Chapter1.873.Sophie,,但是，我们除了尽力让他人能够避免重蹈覆辙，也无法再为她做到更多。,"But on top of trying our best to prevent others from repeating the same tragedy, we can do more."
SAY.Chapter1.874.Sophie,,很多事情，作为不是这所学校学生的你，一个旁观者，无法真正理解我们所经受的压力。,"You are not a student of this school, you're a bystander. As such, you can't possibly understand the pressure we're under."
SAY.Chapter1.879.,,New Info:\nThe school might have put pressure on students.,New Info:\nThe school might have put pressure on students.
SAY.Chapter1.875.Sophie,,不过不管怎样，感谢您的支持，我们会好好使用筹得的善款。,"Anyway, thank you for your support. We will make good use of the donations."
SAY.Chapter1.887.Sophie,,不再考虑一下吗？这么美的花束，送人或用于装饰房间都是不错的选择哦！,Please reconsider! This sort of beautiful bouquet is a good choice for a gift or your own home.
SAY.Chapter1.888.Protagonist,,这可是葬礼花束……,This is a funeral bouquet...
SAY.Chapter1.889.Protagonist,,不过，为什么购买花束所获得的钱会捐赠到反PUA组织？\n我的意思是，Rebecca的死和PUA有什么关系吗?,"But why is the money being donated to anti-PUA organizations? I mean, does Rebecca's death have anything to do with PUAs?"
SAY.Chapter1.890.Sophie,,这么美的花束，送人或用于装饰房间都是不错的选择哦！,This sort of beautiful bouquet is a good choice for a gift or your own home.
SAY.Chapter1.891.Protagonist,,啊这……{i}（不打算正面回答吗。） {/i},…{i} (Are you not going to answer directly.) {/i}
SAY.Chapter1.892.Sophie,,如果您没有什么别的事的话那我就失陪了，这束花我今天一定要卖出去。,"If there is nothing else you need, then I'll leave. I've got to sell these flowers today."
SAY.Chapter1.798.Protagonist,,Rebecca Rochester，看起来确实十分具有魅力。,Rebecca Rochester looks quite attractive indeed.
SAY.Chapter1.799.Protagonist,,比寻常学生更会打扮，但是并不会让人感到张扬，看起来也知书达理落落大方，想必应该成长于一个有文化的中产阶级家庭。,"She has better fashion taste than ordinary students, but without giving the impression that she's ostentatious. Seems to be knowledgeable and generous. She must have grown up in a literate, middle-class family."
SAY.Chapter1.801.Protagonist,,能让这么多人自发为地她哀悼，想必的确是个优秀的人才。,She must have been a figure of some significance for so many people to mourn her spontaneously.
SAY.Chapter1.991.,,New Info:\nRebecca is a elegant and pretty lady.,New Info:\nRebecca is a truly perfect girl.
SAY.Chapter1.802.Protagonist,,再多找人聊聊，了解关于Rebecca Rochester的更多细节。,Talk to more people and learn more details about Rebecca Rochester.
SAY.Chapter1.766.Protagonist,,我市著名高校YIT，为当年最早一批从城市中心搬到郊区的大学。,"YIT, a famous university in this city, was the first center of higher education that moved from the city center to the suburbs."
SAY.Chapter1.767.Protagonist,,教育局领导打着让学生远离城市喧嚣，有一方读书净土的名号，实际却因郊外地皮廉价便宜，远离闹市商区学生无处可去，\n就只能乖乖待在校园，管理方便，所以让许多大学移址郊区。,
SAY.Chapter1.775.Protagonist,,不过看学校后山这么大一片水域，发生一两件溺亡案件也并不会令人感到意外。,It is not entirely surprising that one or two cases of drowning have occurred when there's such large body of water behind the campus.
SAY.Chapter1.774.Protagonist,,现在我的位置是835号公交车站，连接商学院的大门以及环湖大道。,"My current location is  Bus Stop No. 835, which provides service to the business school and Lake Road."
SAY.Chapter1.776.Protagonist,,大学建筑是环湖而建，沿着湖边一直走就能逛完整个学校，没有建得弯弯绕绕真是帮了大忙。,"The university building is built around the lake, and you can walk around the whole school along the shore."
SAY.Chapter1.815.Sophie,,Rebecca学姐即使已经回到天堂，也永远活在我们心中！失去她毫无疑问是我校的巨大损失。,"Even though Rebecca has gone to a better place, she will always live in our hearts! Her passing is, without a doubt, a huge loss for our school."
SAY.Chapter1.818.Protagonist,,{i}（你们对她的爱已经上升到如此的高度了吗?）{/i}所以她为什么去世？疾病？车祸？,{i}(Do you really cherish her that much?){/i}May I ask how she died? Disease? Car accident?
SAY.Chapter1.821.Sophie,,据说Rebecca学姐十分偏爱这片湖的风景，毕业典礼前日凌晨，一定也是想来对这片景色道别吧。,"People say that Rebecca loved the scenery of this lake. She must have wanted to say goodbye to it on that day, in the early morning before her graduation ceremony."
SAY.Chapter1.820.Sophie,,因此才不幸失足落水，葬身于这片平静的湖面，隔日被发现时，身体已经被泡得浮肿了。,"Tragically, she fell and lost her life in these decepitvely calm waters. When she was found the next day, her body was soaked and swollen."
SAY.Chapter1.863.,,New Info:\nRebecca was dead in the midnight.,New Info:\nRebecca was dead in the midnight.
SAY.Chapter1.819.Protagonist,,凌晨？你们学校宿舍没有宵禁吗？我记得我上大学的时候，宿舍11点半就会熄灯锁门。,"Early morning? I take it there's no curfew in your school dorms? When I was in college, the dormitory managers would turn off the lights and lock the doors at 11:30."
SAY.Chapter1.822.Sophie,,我听说Rebecca学姐大学最后一个学期并没有住在宿舍。想必是有什么私人原因吧。,"From what I hear, Rebecca did not live in the dorms in her last semester of school. She must have had her reasons."
MENU.Chapter1.825,,为什么你们到现在才为她举办悼念会?,Why are you only holding a memorial service now?
MENU.Chapter1.826,,为什么要在这里举办悼念会？,Why hold a memorial service here?
SAY.Chapter1.829.Protagonist,,她在两年前不就已经去世了吗?,Hasn't it been two years since she passed away?
SAY.Chapter1.832.Sophie,,最近学校公开宣布，决定在推平湖水后在上面建立新的大楼。,"Recently, the school announced that it will break ground for  a new building on the lake, after draining the water level."
SAY.Chapter1.831.Sophie,,并且所有与Rebecca有交集的学生都将在今年离开校园，于是我们商议后决定在学校开展毕业典礼同时举办悼念会。,"On top of that, all the students who interacted with Rebecca will be gone after this year. So following some discussion, we decided to hold a memorial service before that time's gone and forgotten."
SAY.Chapter1.830.Sophie,,让不幸遇难，没能参加毕业典礼的Rebecca学姐能和我们一起毕业。,"We hope that the unforunate Rebecca,  who failed to attend her own graduation ceremony, can graduate with us."
SAY.Chapter1.834.Protagonist,,一般不都会选择礼堂之类更严肃庄重的室内场地吗？况且还遇到今天下雨，应该会很不方便吧。,"Don’t memorials usually favor more serious indoor venues, such as auditoriums? Besides, things might turn out poorly if it rains today."
SAY.Chapter1.841.Sophie,,学校即将在这里建立的新教学楼，并以Rebecca的名字命名。,The new classroom building that the school will construct here will be named after Rebecca.
SAY.Chapter1.842.Sophie,,并且Rebecca生前十分偏爱湖边的景色，经常在这边晨读散步，所以我们一致认为湖边就是最佳场所。,"In life, Rebecca enjoyed the lakeside scenery very much, and often took morning walks here. So we all agreed that the shore was the best place."
SAY.Chapter1.844.Protagonist,,所以这边才摆放了白色花束。{i}（我还以为是你们年轻人的新潮流）{/i},That's why the white bouquets are placed here. {i}(I thought it was a new trend among young people!){/i}
SAY.Chapter1.847.Sophie,,这些花束同时也是为义卖活动所准备的，仅用十元钱就可以购得Rebecca纪念花束。\n整场悼念会所获得的收入我们会悉数捐献给高校反PUA公益组织。,
SAY.Chapter1.846.Protagonist,,反PUA公益组织？请解释一下，我不熟悉这个概念。,"Anti-PUA charity organization? Please explain, I am not familiar with this concept."
SAY.Chapter1.845.Sophie,,PUA全称Pick Up Artist。\n指通过搭讪以及语言技巧对他人进行人格控制甚至人身控制。,PUA stands for Pick Up Artist. It refers to the personality control and even personal control of others through chatting and language skills.
SAY.Chapter1.849.Sophie,,通过反PUA组织能够更有效宣传PUA对女性的迫害，减少更多类似Rebecca学姐这样的惨案发生。,"Through anti-PUA organizations, PUA’s persecution of women can be more effectively promoted, and more tragedies like Rebecca can be reduced."
SAY.Chapter1.867.,,New Info:\nDid Rebecca ever suffered PUA?,New Info:\nDid Rebecca ever suffered PUA?
SAY.Chapter1.850.Protagonist,,惨案？你刚刚说Rebecca不是失足落水吗？,Massacre? Did you just say that Rebecca fell into the water?
SAY.Chapter1.851.Sophie,,！,！
SAY.Chapter1.852.Sophie,,总而言之，您可以通过购买花束，来表达对Rebecca的惋惜。,"All in all, you can express your regret for Rebecca by purchasing bouquets."
MENU.Chapter1.855,,"购买花束,  算作我对这个反PUA组织的支持吧。",Buying it! Support for anti-PUA.
MENU.Chapter1.856,,"不买,  我今天没有带现金。","No, I didn't bring cash today."
SAY.Chapter1.905.Sophie,,那您自便。,Suit yourself.
SAY.Chapter1.1026.Protagonist,,没事，我只是来打个招呼。,"It's okay, I just came to say hello."
