Key,Description,Standard,EN
SAY.Chapter1.2405.Protagonist,,Can  you tell me more about Rebecca? She seems very popular among students?,
SAY.Chapter1.2406.Sophie,,"Of course! She is almost a legend in my grade. It's hard for me to explain by language, but wherever she is she can always take everybody's concentration.",
SAY.Chapter1.2619.Protagonist,,That sounds like any ordinary school diva. Is it enough to make you admire her? ,
SAY.Chapter1.2620.Sophie,,"No, it's a pity that you can never meet her again. She has a spirit of sacrifying and no matter what you ask, she definity would find a way to help you.",
SAY.Chapter1.2621.Sophie,,Maybe for her responding wishes from people is her responsibility. Sometimes it was tired but she never say no to us.,
SAY.Chapter1.2413.Protagonist,,Do you familiar with Rebecca's boyfriend Antony?,
SAY.Chapter1.2415.Sophie,,Ehh...... The only thing I could say is that Rebecca met the wrong person at a wrong time.,
SAY.Chapter1.2622.Sophie,,She was totally addicted in this relationship and almost be manipulated by Antony.,
SAY.Chapter1.2416.Protagonist,,What do you mean being manipulated?,
SAY.Chapter1.2417.Sophie,,Antony knows Rebecca is such gentle and kind person so he definitly used some tricks to make her obey his order.,
SAY.Chapter1.2419.Sophie,,"Lots of men are good at such kind of skills nowadays. They never treat women with respect. Once they feel bored, they would leave without any guilty.",
SAY.Chapter1.2420.Protagonist,,"Wait, this accusion is very serious, Antony cannot represent all men around the world.",
SAY.Chapter1.2421.Sophie,,"No, the difference is Antony was exposed but most of his fellows are still hidding with a friendly mask. ",
SAY.Chapter1.2438.Protagonist,,How do you feel about your school life? ,
SAY.Chapter1.2440.Sophie,,"How to say...... I really appreciate what I learnt here, but I must admit that the life in YIT is not as perfect as people think.",
SAY.Chapter1.2625.Sophie,,People always imagine that we are elites that can achieve anything easily. But who knows what we pay for behind all the successful.,
SAY.Chapter1.2632.Protagonist,,Do you know anything about Prof. Rochester?,
SAY.Chapter1.2634.Sophie,,"Well, he was the super star in our department. No kidding, many of my classmates apply this school just want to meet him.",
SAY.Chapter1.2640.Protagonist,,Whao! Then his class should be very hard to enroll I suppose.,
SAY.Chapter1.2635.Sophie,,"Exactly, I used to stay up until 4 A.M. to get a seat, but it's really worthwhile.",
SAY.Chapter1.2643.Protagonist,,"I saw a girl looks really similar to Rebecca, she said her name is Dina, do you know anything about her?",
SAY.Chapter1.2645.Sophie,,"That......impossible? I never heard that somebody in school looks like Rebecca? As far as I know, nobody.",
SAY.Chapter1.2712.Protagonist,,"She said she was Rebecca's roommate, did you ever meet her before?",
SAY.Chapter1.2711.Sophie,,"Oh, I do know her roommate. But that girl's name is Maggie, a very quiet and introvertive person. She cannot be similar to Rebecca, in anyway.",
SAY.Chapter1.2704.Protagonist,,"I heard that one of the witnesses is student supervisor Jennifer, do you know where can I find her?",
SAY.Chapter1.2706.Sophie,,"I am sorry, but there is no supervisor in my grade named Jennifer. Perhaps you need to ask a faculty.",
SAY.Chapter1.2718.Protagonist,,Do you recognize a professor named Julian Leros? He is another witness.,
SAY.Chapter1.2720.Sophie,,"Oh yes, I know him. I must say that the reason most students choose his class is not for study, his teaching skill is horrible.",
SAY.Chapter1.2725.Protagonist,,How bad it could be?,
SAY.Chapter1.2726.Sophie,,"Like, he always dreams in his own mind? Never explain the concept and assume that everyone can follow him?",
SAY.Chapter1.2727.Sophie,,"I knew he might be good at analyzing or researching, but teaching is totally different. He cannot ask us to be as smart as him.",
SAY.Chapter1.2728.Protagonist,,Then why some students still choose his class?,
SAY.Chapter1.2729.Sophie,,"There are many reasons, instead of study. His grading is very generous even though the test's difficulty is ridiculous. He never check the attendance record......",
SAY.Chapter1.2730.Sophie,,"And the most important, he is chic. Even I don't like his teaching still but I must admit that he is so good looking. Most of his students are girls who still love teen fiction such as Twilight.",
SAY.Chapter1.2731.Protagonist,,"{i}(To be honest, I can totally understand those girls. Like, who really take university class for serious study?){/i}",
SAY.Chapter1.2466.Protagonist,,"Hey, can I talk more about Rebecca? Do you know what kind of person is she?",
SAY.Chapter1.2468.Anonymous Student,,"Emm...... No that familiar, but I must say I don't like her fans.",
SAY.Chapter1.2469.Anonymous Student,,"Most time is not Rebecca's false, but her fans are really annoying. They don't allow anyone to show critique to Rebecca.",
SAY.Chapter1.2765.Protagonist,,Can you explain it more specifically?,
SAY.Chapter1.2470.Anonymous Student,,"If you say any critical opinion to that Sophie, I swear she will keep pushing you apology untill you surrender. They treat Rebecca as their Queen. That's insane.",
SAY.Chapter1.2766.Anonymous Student,,"But please don't tell this to anyone, I don't want to bargain with any of them. It's totally waste of time.",
SAY.Chapter1.2768.Protagonist,,Do you know this person?,
SAY.Chapter1.2484.Anonymous Student,,"Sorry, I don't know. Maybe you should find somebody else for asking. ",
SAY.Chapter1.2588.Protagonist,,Why should I have to prove anything to you?\n,
SAY.Chapter1.2589.Security,,"Well then, if really don't want to show me anything -\n",
SAY.Chapter1.2590.Security,,I will happily escort you out myself!\n,
SAY.Chapter1.2597.Protagonist,,I'm here for Professor Rochester. I'm one of his ex-students - I wanted to come and pay respects on the anniversary of Rebecca's passing.\n,
SAY.Chapter1.2598.Security,,A lot of journalists have been hanging around saying the exact same thing.\n,
SAY.Chapter1.2599.Security,,How can I trust that you're not one of them?\n,
SAY.Chapter1.2600.Protagonist,,{i}(They must have had a lot of issues with the press to be this suspicious. How do I get past him?){/i}\n,
SAY.Chapter1.2654.Protagonist,,There is one important witness refused to show during the trial.,
SAY.Chapter1.2655.Protagonist,,If I could find who he or she is then my investigation should make a huge progress.,
SAY.Chapter1.2662.Protagonist,,"Wait, what is this deal? Who deal with that witness?",
SAY.Chapter1.2664.Protagonist,,"Even though this was only policeman's assumption, what about it was true?",
SAY.Chapter1.2663.Protagonist,,Cannot imagine that we might let a murderer run away.,
SAY.Chapter1.2667.Protagonist,,Jennifer is the student supervisor. I remember I had one supervisor when I was an undergraduate student.,
SAY.Chapter1.2668.Protagonist,,Supervisor is a very embarrasing position in the university. They are not professor nor student but they have the power of managing student's daily life.,
SAY.Chapter1.2669.Protagonist,,"No wonder we really hated them at that time. After all, the only thing that 18 years teenagers care are freedom and rebellion.",
SAY.Chapter1.2675.Protagonist,,"Emm......The last time she saw Rebecca was around {color=red} 8 A.M. {/color}, that was definitely over the regular working time.",
SAY.Chapter1.2676.Protagonist,,Why she stayed here at that time? Just waited for Rebecca? ,
SAY.Chapter1.2672.Protagonist,,Julian is the assistant professor and he met Antony at 10 P.M....,
SAY.Chapter1.2673.Protagonist,,Usually assistant professors will do a lot of extra works because they are at the bottom of hierarchy.,
SAY.Chapter1.2686.Protagonist,,"And sometimes those works are really boring, no relationship with their own research at all.",
SAY.Chapter1.2674.Protagonist,,"But 10 P.M. is too late, that is even against the labor law. If the school make him work that late, he need to report to the union.",
SAY.Chapter1.2739.Protagonist,,I missed so much the billboard. You can always find interesting advertisement on it.,
SAY.Chapter1.2741.Protagonist,,It's our secret flea market. You can trade anything with just a short introduction and a couple of your phone number.,
SAY.Chapter1.2740.Protagonist,,I still remember the first page that I sticked on the board is an advertisement of selling English class cheat-sheet.,
SAY.Chapter1.2753.Protagonist,,Every university has a fountain like that. ,
SAY.Chapter1.2754.Protagonist,,"Usually it only turns on when some events happen, like the anniversary or President visit.",
SAY.Chapter1.2755.Protagonist,,I wonder how much YIT pay for this fountain if it runs day and night.,
SAY._CommandCopyBuffer.1860.Security,,I'm going to need to know more than that to let you in.\n,
CHARACTER.Shop Assistant,,Shop Assistant,
CHARACTER.Protagonist,,Protagonist,
CHARACTER.Anonymous Student,,Anonymous Student,Anonymous Student
CHARACTER.Security,,Security,
CHARACTER.Bus Broadcast,,Bus Broadcast,Bus Broadcast
CHARACTER.Sophie,,Sophie,Sophie
CHARACTER.Dina,,Dina,
CHARACTER.Robert,,Robert,Robert
\n,This behavior smells like a cover-up... does this case have some hidden connection with the school's affairs?,,
"Thank you, this is your bouquet! In remembrance of Rebecca...","Thank you, this is your bouquet! In remembrance of Rebecca...",,
,"The Bureau of Education announced that the moves would provide a quiet place to study, but the true reason was that suburban land is cheap, and since students have nowhere to go, they'll tend to stay on the campus. Thus, many universities were moved to the suburbs.",,
){/i}\n,,,
谢谢，这是您的花束！Rebecca学姐在天之灵会保佑您的。,,,
\n就只能乖乖待在校园，管理方便，所以让许多大学移址郊区。,,,
\n整场悼念会所获得的收入我们会悉数捐献给高校反PUA公益组织。,,,
\n不过，这个活动确实花费了我们不少时间去做前期准备工作。,,,
